### ISSUE TITLE
在k8s+nacos-1.4.2的环境下，通过域名访问（nacos-server:8848）去访问，发现注册成功后又被移除

### ISSUE THREAD

**Issue by zhenlanzhuang** [alibaba/nacos#5788]
**问题：**
在k8s+nacos-1.4.2的环境下，通过域名访问（nacos-server:8848）去访问，发现注册成功后又被移除，后续就无法注册到nacos，除非重启服务，重启后一段时间服务又被移除；
**环境信息：**
单机部署k8s+nacos,mode为standalone；nacos-server版本为1.4.2.nacos-client版本为1.4.1,jdk版本为11
**定位过程：**
进入nacos的容器环境中，查看netstat，服务（20个服务，36个实例）的tcp连接都成功建立；
进入到服务容器中，通过curl -X GET 'nacos-server:8848/nacos/v1/ns/service/list?serviceName=xxx'''，请求可以正常访问；
查看服务日志未发现有报错，服务扔正常运转；
检查域名服务也是正常；
将springboot的bootstrap.yml 的nacos地址换成实际ip（通过环境变量获取），服务恢复正常；
**咨询一下各路大神这个可能是什么原因？**

**Comment by zhenlanzhuang** [comment]
> 改成ip就可以，说明nacos本身是没有问题的。通过域名访问注册成功被摘除，说明注册的时候域名是ok的。之后心跳处理的时候域名可能就有问题了？ 这块可能和环境本身有关了。需要自身排查下。

今天早上过来发现ip注册的也被移除了，除了服务异常还有什么原因可能导致服务被nacos移除？

**Comment by zhenlanzhuang** [comment]
> 改成ip就可以，说明nacos本身是没有问题的。通过域名访问注册成功被摘除，说明注册的时候域名是ok的。之后心跳处理的时候域名可能就有问题了？ 这块可能和环境本身有关了。需要自身排查下。

[DEBUG]2021-05-20 14:00:31.083 [,] [com.alibaba.nacos.client.Worker.longPolling.fixed-nacos-server_8848] [NacosRestTemplate.java : 494] - Execute via interceptors :[com.alibaba.nacos.client.config.impl.ConfigHttpClientManager$LimiterHttpClientRequestInterceptor@51acdf2e]
[WARN ]2021-05-20 14:00:33.835 [,] [com.alibaba.nacos.client.naming.updater] [HostReactor.java : 484] - [NA] failed to update serviceName: DEFAULT_GROUP@@xxxx-service
java.lang.IllegalArgumentException: The IPv4 address("nacos-server") is incorrect.
        at com.alibaba.nacos.common.utils.IPUtil.splitIPPortStr(IPUtil.java:152)
        at com.alibaba.nacos.common.utils.IPUtil.containsPort(IPUtil.java:119)
        at com.alibaba.nacos.client.naming.net.NamingProxy.callServer(NamingProxy.java:595)
        at com.alibaba.nacos.client.naming.net.NamingProxy.reqApi(NamingProxy.java:526)
        at com.alibaba.nacos.client.naming.net.NamingProxy.reqApi(NamingProxy.java:498)
        at com.alibaba.nacos.client.naming.net.NamingProxy.reqApi(NamingProxy.java:493)
        at com.alibaba.nacos.client.naming.net.NamingProxy.queryList(NamingProxy.java:407)
        at com.alibaba.nacos.client.naming.core.HostReactor.updateService(HostReactor.java:378)
        at com.alibaba.nacos.client.naming.core.HostReactor$UpdateTask.run(HostReactor.java:460)
        at java.base/java.util.concurrent.Executors$RunnableAdapter.call(Unknown Source)
        at java.base/java.util.concurrent.FutureTask.run(Unknown Source)
        at java.base/java.util.concurrent.ScheduledThreadPoolExecutor$ScheduledFutureTask.run(Unknown Source)
        at java.base/java.util.concurrent.ThreadPoolExecutor.runWorker(Unknown Source)
        at java.base/java.util.concurrent.ThreadPoolExecutor$Worker.run(Unknown Source)
        at java.base/java.lang.Thread.run(Unknown Source)
[DEBUG]2021-05-20 14:00:34.641 [,] [com.alibaba.nacos.naming.failover] [FailoverReactor.java : 147] - failover switch is not found, failover00-00---000-VIPSRV_FAILOVER_SWITCH-000---00-00
[WARN ]2021-05-20 14:00:35.836 [,] [com.alibaba.nacos.client.naming.updater] [HostReactor.java : 484] - [NA] failed to update serviceName: DEFAULT_GROUP@@xxxx-service
java.lang.IllegalArgumentException: The IPv4 address("nacos-server") is incorrect.
        at com.alibaba.nacos.common.utils.IPUtil.splitIPPortStr(IPUtil.java:152)
        at com.alibaba.nacos.common.utils.IPUtil.containsPort(IPUtil.java:119)
        at com.alibaba.nacos.client.naming.net.NamingProxy.callServer(NamingProxy.java:595)
        at com.alibaba.nacos.client.naming.net.NamingProxy.reqApi(NamingProxy.java:526)
        at com.alibaba.nacos.client.naming.net.NamingProxy.reqApi(NamingProxy.java:498)
        at com.alibaba.nacos.client.naming.net.NamingProxy.reqApi(NamingProxy.java:493)
        at com.alibaba.nacos.client.naming.net.NamingProxy.queryList(NamingProxy.java:407)
        at com.alibaba.nacos.client.naming.core.HostReactor.updateService(HostReactor.java:378)
        at com.alibaba.nacos.client.naming.core.HostReactor$UpdateTask.run(HostReactor.java:460)
        at java.base/java.util.concurrent.Executors$RunnableAdapter.call(Unknown Source)
        at java.base/java.util.concurrent.FutureTask.run(Unknown Source)
        at java.base/java.util.concurrent.ScheduledThreadPoolExecutor$ScheduledFutureTask.run(Unknown Source)
        at java.base/java.util.concurrent.ThreadPoolExecutor.runWorker(Unknown Source)
        at java.base/java.util.concurrent.ThreadPoolExecutor$Worker.run(Unknown Source)
        at java.base/java.lang.Thread.run(Unknown Source)
[DEBUG]2021-05-20 14:00:39.641 [,] [com.alibaba.nacos.naming.failover] [FailoverReactor.java : 147] - failover switch is not found, failover00-00---000-VIPSRV_FAILOVER_SWITCH-000---00-00
[WARN ]2021-05-20 14:00:39.836 [,] [com.alibaba.nacos.client.naming.updater] [HostReactor.java : 484] - [NA] failed to update serviceName: DEFAULT_GROUP@@xxxx-service
java.lang.IllegalArgumentException: The IPv4 address("nacos-server") is incorrect.
        at com.alibaba.nacos.common.utils.IPUtil.splitIPPortStr(IPUtil.java:152)
        at com.alibaba.nacos.common.utils.IPUtil.containsPort(IPUtil.java:119)
        at com.alibaba.nacos.client.naming.net.NamingProxy.callServer(NamingProxy.java:595)
        at com.alibaba.nacos.client.naming.net.NamingProxy.reqApi(NamingProxy.java:526)
        at com.alibaba.nacos.client.naming.net.NamingProxy.reqApi(NamingProxy.java:498)
        at com.alibaba.nacos.client.naming.net.NamingProxy.reqApi(NamingProxy.java:493)
        at com.alibaba.nacos.client.naming.net.NamingProxy.queryList(NamingProxy.java:407)
        at com.alibaba.nacos.client.naming.core.HostReactor.updateService(HostReactor.java:378)
        at com.alibaba.nacos.client.naming.core.HostReactor$UpdateTask.run(HostReactor.java:460)
        at java.base/java.util.concurrent.Executors$RunnableAdapter.call(Unknown Source)
        at java.base/java.util.concurrent.FutureTask.run(Unknown Source)
        at java.base/java.util.concurrent.ScheduledThreadPoolExecutor$ScheduledFutureTask.run(Unknown Source)
        at java.base/java.util.concurrent.ThreadPoolExecutor.runWorker(Unknown Source)
        at java.base/java.util.concurrent.ThreadPoolExecutor$Worker.run(Unknown Source)
        at java.base/java.lang.Thread.run(Unknown Source)
[DEBUG]2021-05-20 14:00:41.204 [,] [com.alibaba.nacos.naming.beat.sender] [NamingProxy.java : 421] - [BEAT] public sending beat to server: BeatInfo{port=8091, ip='0.0.0.193', weight=1.0, serviceName='DEFAULT_GROUP@@xxxx-service', cluster='DEFAULT', metadata={preserved.register.source=SPRING_CLOUD, gRPC.port=9191}, scheduled=false, period=5000, stopped=false}
[DEBUG]2021-05-20 14:00:44.642 [,] [com.alibaba.nacos.naming.failover] [FailoverReactor.java : 147] - failover switch is not found, failover00-00---000-VIPSRV_FAILOVER_SWITCH-000---00-00
[DEBUG]2021-05-20 14:00:47.838 [,] [com.alibaba.nacos.client.naming.updater] [NacosRestTemplate.java : 476] - HTTP method: GET, url: http://nacos-server:8848/nacos/v1/ns/instance/list?app=unknown&healthyOnly=false&namespaceId=public&clientIP=0.0.0.193&serviceName=DEFAULT_GROUP%40%40xxxx-service&udpPort=40750&clusters=DEFAULT, body: {}
[DEBUG]2021-05-20 14:00:49.618 [,] [com.alibaba.nacos.client.naming.updater] [NamingProxy.java : 195] - server list provided by user: [nacos-server:8848]
[DEBUG]2021-05-20 14:00:49.642 [,] [com.alibaba.nacos.naming.failover] [FailoverReactor.java : 147] - failover switch is not found, failover00-00---000-VIPSRV_FAILOVER_SWITCH-000---00-00
[DEBUG]2021-05-20 14:00:54.643 [,] [com.alibaba.nacos.naming.failover] [FailoverReactor.java : 147] - failover switch is not found, failover00-00---000-VIPSRV_FAILOVER_SWITCH-000---00-00
[INFO ]2021-05-20 14:00:55.780 [,] [com.alibaba.nacos.naming.push.receiver] [PushReceiver.java : 86] - received push data: {"type":"dom","data":"{\"hosts\":[{\"ip\":\"0.0.0.193\",\"port\":8091,\"valid\":true,\"healthy\":true,\"marked\":false,\"instanceId\":\"0.0.0.193#8091#DEFAULT#DEFAULT_GROUP@@xxxx-service\",\"metadata\":{\"preserved.register.source\":\"SPRING_CLOUD\",\"gRPC.port\":\"9191\"},\"enabled\":true,\"weight\":1.0,\"clusterName\":\"DEFAULT\",\"serviceName\":\"DEFAULT_GROUP@@xxxx-service\",\"ephemeral\":true}],\"dom\":\"DEFAULT_GROUP@@xxxx-service\",\"name\":\"DEFAULT_GROUP@@xxxx-service\",\"cacheMillis\":10000,\"lastRefTime\":1621490455779,\"checksum\":\"af46028b801f2bc7ed5fdcec6a882d47\",\"useSpecifiedURL\":false,\"clusters\":\"DEFAULT\",\"env\":\"\",\"metadata\":{}}","lastRefTime":154309720596657} from /0.0.0.6
[DEBUG]2021-05-20 14:00:57.842 [,] [com.alibaba.nacos.client.naming.updater] [NacosRestTemplate.java : 476] - HTTP method: GET, url: http://nacos-server:8848/nacos/v1/ns/instance/list?app=unknown&healthyOnly=false&namespaceId=public&clientIP=0.0.0.193&serviceName=DEFAULT_GROUP%40%40xxxx-service&udpPort=40750&clusters=DEFAULT, body: {}
[DEBUG]2021-05-20 14:00:59.643 [,] [com.alibaba.nacos.naming.failover] [FailoverReactor.java : 147] - failover switch is not found, failover00-00---000-VIPSRV_FAILOVER_SWITCH-000---00-00
[DEBUG]2021-05-20 14:01:00.586 [,] [com.alibaba.nacos.client.Worker.longPolling.fixed-nacos-server_8848] [NacosRestTemplate.java : 476] - HTTP method: POST, url: http://nacos-server:8848/nacos/v1/cs/configs/listener, body: {Listening-Configs=xxxx-serviceDEFAULT_GROUPxxxx-service.propertiesDEFAULT_GROUP}
[DEBUG]2021-05-20 14:01:00.586 [,] [com.alibaba.nacos.client.Worker.longPolling.fixed-nacos-server_8848] [NacosRestTemplate.java : 494] - Execute via interceptors :[com.alibaba.nacos.client.config.impl.ConfigHttpClientManager$LimiterHttpClientRequestInterceptor@51acdf2e]
[DEBUG]2021-05-20 14:01:04.643 [,] [com.alibaba.nacos.naming.failover] [FailoverReactor.java : 147] - failover switch is not found, failover00-00---000-VIPSRV_FAILOVER_SWITCH-000---00-00
[DEBUG]2021-05-20 14:01:07.845 [,] [com.alibaba.nacos.client.naming.updater] [NacosRestTemplate.java : 476] - HTTP method: GET, url: http://nacos-server:8848/nacos/v1/ns/instance/list?app=unknown&healthyOnly=false&namespaceId=public&clientIP=0.0.0.193&serviceName=DEFAULT_GROUP%40%40xxxx-service&udpPort=40750&clusters=DEFAULT, body: {}
[DEBUG]2021-05-20 14:01:09.644 [,] [com.alibaba.nacos.naming.failover] [FailoverReactor.java : 147] - failover switch is not found, failover00-00---000-VIPSRV_FAILOVER_SWITCH-000---00-00
[INFO ]2021-05-20 14:01:10.782 [,] [com.alibaba.nacos.naming.push.receiver] [PushReceiver.java : 86] - received push data: {"type":"dom","data":"{\"dom\":\"DEFAULT_GROUP@@xxxx-service\",\"name\":\"DEFAULT_GROUP@@xxxx-service\",\"cacheMillis\":10000,\"lastRefTime\":1621490470781,\"checksum\":\"7a9c4613214d94ee6210421eb204969d\",\"useSpecifiedURL\":false,\"clusters\":\"DEFAULT\",\"env\":\"\",\"hosts\":[],\"metadata\":{}}","lastRefTime":154324722937701} from /0.0.0.6
[INFO ]2021-05-20 14:01:10.783 [,] [com.alibaba.nacos.naming.push.receiver] [HostReactor.java : 234] - removed ips(1) service: DEFAULT_GROUP@@xxxx-service@@DEFAULT -> [{"instanceId":"0.0.0.193#8091#DEFAULT#DEFAULT_GROUP@@xxxx-service","ip":"0.0.0.193","port":8091,"weight":1.0,"healthy":true,"enabled":true,"ephemeral":true,"clusterName":"DEFAULT","serviceName":"DEFAULT_GROUP@@xxxx-service","metadata":{"preserved.register.source":"SPRING_CLOUD","gRPC.port":"9191"},"instanceHeartBeatInterval":5000,"instanceHeartBeatTimeOut":15000,"ipDeleteTimeout":30000}]
[DEBUG]2021-05-20 14:01:10.783 [,] [nacos.publisher-com.alibaba.nacos.client.naming.event.InstancesChangeEvent] [DefaultPublisher.java : 193] - [NotifyCenter] the com.alibaba.nacos.client.naming.event.InstancesChangeEvent@307ffcef will received by com.alibaba.nacos.client.naming.event.InstancesChangeNotifier@1e3e1014
[INFO ]2021-05-20 14:01:10.783 [,] [com.alibaba.nacos.naming.push.receiver] [HostReactor.java : 267] - current ips:(0) service: DEFAULT_GROUP@@xxxx-service@@DEFAULT -> []
[DEBUG]2021-05-20 14:01:14.644 [,] [com.alibaba.nacos.naming.failover] [FailoverReactor.java : 147] - failover switch is not found, failover00-00---000-VIPSRV_FAILOVER_SWITCH-000---00-00
[DEBUG]2021-05-20 14:01:17.849 [,] [com.alibaba.nacos.client.naming.updater] [NacosRestTemplate.java : 476] - HTTP method: GET, url: http://nacos-server:8848/nacos/v1/ns/instance/list?app=unknown&healthyOnly=false&namespaceId=public&clientIP=0.0.0.193&serviceName=DEFAULT_GROUP%40%40xxxx-service&udpPort=40750&clusters=DEFAULT, body: {}
[DEBUG]2021-05-20 14:01:19.619 [,] [com.alibaba.nacos.client.naming.updater] [NamingProxy.java : 195] - server list provided by user: [nacos-server:8848]
[DEBUG]2021-05-20 14:01:19.645 [,] [com.alibaba.nacos.naming.failover] [FailoverReactor.java : 147] - failover switch is not found, failover00-00---000-VIPSRV_FAILOVER_SWITCH-000---00-00
[DEBUG]2021-05-20 14:01:19.852 [,] [com.alibaba.nacos.client.naming.updater] [NacosRestTemplate.java : 476] - HTTP method: GET, url: http://nacos-server:8848/nacos/v1/ns/instance/list?app=unknown&healthyOnly=false&namespaceId=public&clientIP=0.0.0.193&serviceName=DEFAULT_GROUP%40%40xxxx-service&udpPort=40750&clusters=DEFAULT, body: {}
[DEBUG]2021-05-20 14:01:23.855 [,] [com.alibaba.nacos.client.naming.updater] [NacosRestTemplate.java : 476] - HTTP method: GET, url: http://nacos-server:8848/nacos/v1/ns/instance/list?app=unknown&healthyOnly=false&namespaceId=public&clientIP=0.0.0.193&serviceName=DEFAULT_GROUP%40%40xxxx-service&udpPort=40750&clusters=DEFAULT, body: {}
[DEBUG]2021-05-20 14:01:24.645 [,] [com.alibaba.nacos.naming.failover] [FailoverReactor.java : 147] - failover switch is not found, failover00-00---000-VIPSRV_FAILOVER_SWITCH-000---00-00
[DEBUG]2021-05-20 14:01:29.645 [,] [com.alibaba.nacos.naming.failover] [FailoverReactor.java : 147] - failover switch is not found, failover00-00---000-VIPSRV_FAILOVER_SWITCH-000---00-00
[DEBUG]2021-05-20 14:01:30.088 [,] [com.alibaba.nacos.client.Worker.longPolling.fixed-nacos-server_8848] [NacosRestTemplate.java : 476] - HTTP method: POST, url: http://nacos-server:8848/nacos/v1/cs/configs/listener, body: {Listening-Configs=xxxx-serviceDEFAULT_GROUPxxxx-service.propertiesDEFAULT_GROUP}
[DEBUG]2021-05-20 14:01:30.089 [,] [com.alibaba.nacos.client.Worker.longPolling.fixed-nacos-server_8848] [NacosRestTemplate.java : 494] - Execute via interceptors :[com.alibaba.nacos.client.config.impl.ConfigHttpClientManager$LimiterHttpClientRequestInterceptor@51acdf2e]
[DEBUG]2021-05-20 14:01:31.858 [,] [com.alibaba.nacos.client.naming.updater] [NacosRestTemplate.java : 476] - HTTP method: GET, url: http://nacos-server:8848/nacos/v1/ns/instance/list?app=unknown&healthyOnly=false&namespaceId=public&clientIP=0.0.0.193&serviceName=DEFAULT_GROUP%40%40xxxx-service&udpPort=40750&clusters=DEFAULT, body: {}

开启debug日志后，发现有warn日志，域名解析失败，但后面又恢复连接之后，nacos无法自动注册到nacos上

**Comment by KomachiSion** [comment]
那根据描述应该是心跳问题，1.4.2好像修复过一个关于心跳线程的问题，能否升级一下客户端再试试看

**Comment by zhenlanzhuang** [comment]
> 问题

客户端升级至1.4.2后发现问题依然存在，后续通过定位发现是服务器的iptable出了问题；
但通过抓包发现nacos-client在原有连接还存在且能正常启用的时候会去起新的连接，请问这是出于什么考虑这么设计？
附：抓包数据
106	24.854006	10.42.0.89	10.42.0.55	HTTP	628	GET /nacos/v1/ns/instance/list?app=unknown&healthyOnly=false&namespaceId=public&clientIP=10.42.0.89&serviceName=DEFAULT_GROUP%40%40dems-account-service&udpPort=48850&clusters=DEFAULT HTTP/1.1 
107	25.011714	10.42.0.89	10.42.0.55	TCP	74	46440 → 8848 [SYN] Seq=0 Win=28200 Len=0 MSS=1410 SACK_PERM=1 TSval=1176025752 TSecr=0 WS=128
108	25.055776	10.42.0.89	10.42.0.55	TCP	628	[TCP Retransmission] 40432 → 8848 [PSH, ACK] Seq=4925 Ack=10298 Win=1393 Len=562 TSval=1176025796 TSecr=1124461570
109	25.263773	10.42.0.89	10.42.0.55	TCP	628	[TCP Retransmission] 40432 → 8848 [PSH, ACK] Seq=4925 Ack=10298 Win=1393 Len=562 TSval=1176026004 TSecr=1124461570
110	25.672778	10.42.0.89	10.42.0.55	TCP	628	[TCP Retransmission] 40432 → 8848 [PSH, ACK] Seq=4925 Ack=10298 Win=1393 Len=562 TSval=1176026413 TSecr=1124461570
111	26.040774	10.42.0.89	10.42.0.55	TCP	74	[TCP Retransmission] 46440 → 8848 [SYN] Seq=0 Win=28200 Len=0 MSS=1410 SACK_PERM=1 TSval=1176026781 TSecr=0 WS=128
112	26.487774	10.42.0.89	10.42.0.55	TCP	628	[TCP Retransmission] 40432 → 8848 [PSH, ACK] Seq=4925 Ack=10298 Win=1393 Len=562 TSval=1176027228 TSecr=1124461570
113	28.020037	10.42.0.89	10.42.0.55	TCP	74	40810 → 8848 [SYN] Seq=0 Win=28200 Len=0 MSS=1410 SACK_PERM=1 TSval=1176028760 TSecr=0 WS=128
114	28.151781	10.42.0.89	10.42.0.55	TCP	628	[TCP Retransmission] 40432 → 8848 [PSH, ACK] Seq=4925 Ack=10298 Win=1393 Len=562 TSval=1176028892 TSecr=1124461570
114	28.151781	10.42.0.89	10.42.0.55	TCP	628	[TCP Retransmission] 40432 → 8848 [PSH, ACK] Seq=4925 Ack=10298 Win=1393 Len=562 TSval=1176028892 TSecr=1124461570
116	31.024055	10.42.0.89	10.42.0.55	TCP	74	51410 → 8848 [SYN] Seq=0 Win=28200 Len=0 MSS=1410 SACK_PERM=1 TSval=1176031764 TSecr=0 WS=128
117	31.416780	10.42.0.89	10.42.0.55	TCP	628	[TCP Retransmission] 40432 → 8848 [PSH, ACK] Seq=4925 Ack=10298 Win=1393 Len=562 TSval=1176032157 TSecr=1124461570
118	32.056771	10.42.0.89	10.42.0.55	TCP	74	[TCP Retransmission] 51410 → 8848 [SYN] Seq=0 Win=28200 Len=0 MSS=1410 SACK_PERM=1 TSval=1176032797 TSecr=0 WS=128
119	37.879776	10.42.0.89	10.42.0.55	TCP	628	[TCP Retransmission] 40432 → 8848 [PSH, ACK] Seq=4925 Ack=10298 Win=1393 Len=562 TSval=1176038620 TSecr=1124461570
120	39.027933	10.42.0.89	10.42.0.3	DNS	98	Standard query 0xe6e7 A nacos-server.default.svc.cluster.local
121	39.481636	10.42.0.72	10.42.0.89	TCP	83	53406 → 29320 [PSH, ACK] Seq=1 Ack=1 Win=221 Len=17 TSval=894598071 TSecr=472908762
122	39.687774	10.42.0.72	10.42.0.89	TCP	83	[TCP Retransmission] 53406 → 29320 [PSH, ACK] Seq=1 Ack=1 Win=221 Len=17 TSval=894598278 TSecr=472908762
123	39.867961	10.42.0.71	10.42.0.89	TCP	83	53296 → 29320 [PSH, ACK] Seq=1 Ack=1 Win=221 Len=17 TSval=3549523549 TSecr=467996291
124	39.895777	10.42.0.72	10.42.0.89	TCP	83	[TCP Retransmission] 53406 → 29320 [PSH, ACK] Seq=1 Ack=1 Win=221 Len=17 TSval=894598486 TSecr=472908762
125	40.071774	10.42.0.71	10.42.0.89	TCP	83	[TCP Retransmission] 53296 → 29320 [PSH, ACK] Seq=1 Ack=1 Win=221 Len=17 TSval=3549523753 TSecr=467996291
126	40.279778	10.42.0.71	10.42.0.89	TCP	83	[TCP Retransmission] 53296 → 29320 [PSH, ACK] Seq=1 Ack=1 Win=221 Len=17 TSval=3549523961 TSecr=467996291
127	40.303775	10.42.0.72	10.42.0.89	TCP	83	[TCP Retransmission] 53406 → 29320 [PSH, ACK] Seq=1 Ack=1 Win=221 Len=17 TSval=894598894 TSecr=472908762
128	40.687778	10.42.0.71	10.42.0.89	TCP	83	[TCP Retransmission] 53296 → 29320 [PSH, ACK] Seq=1 Ack=1 Win=221 Len=17 TSval=3549524369 TSecr=467996291
129	41.143773	10.42.0.72	10.42.0.89	TCP	83	[TCP Retransmission] 53406 → 29320 [PSH, ACK] Seq=1 Ack=1 Win=221 Len=17 TSval=894599734 TSecr=472908762
130	41.527776	10.42.0.71	10.42.0.89	TCP	83	[TCP Retransmission] 53296 → 29320 [PSH, ACK] Seq=1 Ack=1 Win=221 Len=17 TSval=3549525209 TSecr=467996291
131	42.808782	10.42.0.72	10.42.0.89	TCP	83	[TCP Retransmission] 53406 → 29320 [PSH, ACK] Seq=1 Ack=1 Win=221 Len=17 TSval=894601399 TSecr=472908762
132	43.192773	10.42.0.71	10.42.0.89	TCP	83	[TCP Retransmission] 53296 → 29320 [PSH, ACK] Seq=1 Ack=1 Win=221 Len=17 TSval=3549526874 TSecr=467996291

**Comment by KomachiSion** [comment]
iptable问题修复之后还有吗？

抓包来看TCP一直在Retransmission，这和nacos就没有关系了，似乎是4层连接一直在重传，建议还是排查下环境，是不是网络或者其他地方有问题，导致tcp传输一直有问题。

**Comment by zhenlanzhuang** [comment]
> iptable问题修复之后还有吗？
> 
> 抓包来看TCP一直在Retransmission，这和nacos就没有关系了，似乎是4层连接一直在重传，建议还是排查下环境，是不是网络或者其他地方有问题，导致tcp传输一直有问题。

修复之后，服务重启之后就没问题了；
现在有个疑问是，server端已经把服务移除，但client端连接为何还是正常的，没有报错，无法感知到server端服务已经被移除

**Comment by KomachiSion** [comment]
重传是TCP层面的，不会吐露到应用层， 应用层可能会有超时的异常
在${user.home}/logs/nacos/naming.log里

**Comment by bingju328** [comment]
我的问题是 k8s + nacos 1.4.1版本，在k8s里面，用一段时间就断开注册中心 , dig cluster 正常，然后需要重新启动所有的pods才能重新注册，楼主你的问题解决了么

**Comment by zhenlanzhuang** [comment]
> 我的问题是 k8s + nacos 1.4.1版本，在k8s里面，用一段时间就断开注册中心 , dig cluster 正常，然后需要重新启动所有的pods才能重新注册，楼主你的问题解决了么

解决了，根因是pod无法解析DNS；
如果 Node 上安装的 Docker 版本大于 1.12，那么 Docker 会把默认的 iptables FORWARD 策略改为 DROP。这会引发 Pod 网络访问的问题。解决方法则在每个 Node 上面运行 iptables -P FORWARD ACCEPT，比如

echo "ExecStartPost=/sbin/iptables -P FORWARD ACCEPT" >> /etc/systemd/system/docker.service.d/exec_start.conf
systemctl daemon-reload
systemctl restart docker
如果使用了 flannel/weave 网络插件，更新为最新版本也可以解决这个问题。

**Comment by bingju328** [comment]
多谢多谢，我试试，我这边也是dns解析失败，失败后抛出异常，把nacos的心跳线程给打断了，导致注册不上了

**Comment by klay-xin** [comment]
我的问题是nacos2.0.3版本, 没有用到docker和k8s, 今天第一次出现某一个的服务断开注册中心, 重启之后就可以正常连接,  想请教一下楼主改如何解决此问题
